{
  "schemaVersion": "turso-d1-migration-receipt.v1",
  "projectId": "swe-interview-prep",
  "mode": "cutover",
  "authority": "d1",
  "source": {
    "provider": "none",
    "name": "swe-interview-prep",
    "role": "none",
    "schemaRevision": null,
    "sizeBytes": 266240
  },
  "target": {
    "provider": "cloudflare-d1",
    "name": "swe-interview-prep",
    "role": "authoritative",
    "schemaRevision": "0001_initial.sql",
    "sizeBytes": 286720
  },
  "schemaChecks": [
    {
      "id": "source-catalog-shape",
      "status": "pass",
      "sourceValue": "19 tables, 5 explicit indexes",
      "targetValue": "19 application tables, 5 explicit indexes",
      "detail": "The deterministic D1 baseline preserves every source application table and explicit index; Wrangler adds only its migration ledger."
    },
    {
      "id": "local-and-remote-d1-migration",
      "status": "pass",
      "sourceValue": null,
      "targetValue": "1 migration, 25 commands",
      "detail": "Wrangler applied the tracked baseline to isolated local D1 and both production and preview D1 databases."
    },
    {
      "id": "local-and-remote-foreign-key-check",
      "status": "pass",
      "sourceValue": null,
      "targetValue": 0,
      "detail": "PRAGMA foreign_key_check returned no rows after local rehearsal or after the production import."
    }
  ],
  "dataChecks": [
    {
      "id": "production-row-parity",
      "status": "pass",
      "sourceValue": "32 rows across 19 application tables; users/daily-plan signatures 445/14194",
      "targetValue": "32 rows across 19 application tables; users/daily-plan signatures 445/14194",
      "detail": "Every application-table row count and both representative full-row aggregate signatures matched; users has 2 rows, daily_plan has 30, and all other application tables are empty."
    },
    {
      "id": "preview-data-policy",
      "status": "pass",
      "sourceValue": "no approved sanitized fixture set",
      "targetValue": "schema only; 0 application rows",
      "detail": "SWE Interview Prep preview remains schema-only because this personal-use product has no maintained sanitized fixture set."
    }
  ],
  "journeyChecks": [
    {
      "id": "authenticated-pages-d1",
      "status": "pass",
      "sourceValue": null,
      "targetValue": "auth, progress, mastery, notes, projects, and activity HTTP 200",
      "detail": "The real local Pages Functions runtime authenticated the synthetic owner and read every required D1-backed state surface."
    },
    {
      "id": "progress-write-readback",
      "status": "pass",
      "sourceValue": null,
      "targetValue": "HTTP 200 and persisted readback",
      "detail": "A Pages Function progress upsert succeeded through the native D1 adapter and appeared on the next read."
    },
    {
      "id": "repository-validation",
      "status": "pass",
      "sourceValue": null,
      "targetValue": "334 tests, typecheck, Biome, docs, size limit, production build, merged-main CI",
      "detail": "All migration-relevant local, pull-request, and merged-main checks passed."
    },
    {
      "id": "production-cutover",
      "status": "pass",
      "sourceValue": "Turso rollback-held",
      "targetValue": "Pages deployment a3714565-aec4-4c86-8e43-b1c58e27391e; source a515ae1f5251d3987166416b6aa05931ffe0f28d",
      "detail": "The production and preview D1 bindings, migration gates, deployment workflow, homepage, anonymous auth/progress guards, and learning method guard all passed against the final main deployment."
    }
  ],
  "timings": {
    "observedAt": "2026-08-01T17:37:39Z",
    "rehearsalMs": null,
    "writeFreezeMs": null
  },
  "approval": {
    "remoteMutationApproved": true,
    "cutoverApproved": true,
    "retirementApproved": true
  },
  "rollback": {
    "sourcePreserved": false,
    "releaseAvailable": false,
    "reconciliationRequired": false
  },
  "result": "pass",
  "notes": [
    "The D1 query adapter and data-only import converter add no dependencies; @libsql/client and ten transitive packages were removed.",
    "A real Pages rehearsal exposed and fixed a legacy verifier module-load failure that had blocked authenticated learning actions in the Pages runtime.",
    "Code cleanup retains pre-existing audit advisories and unrelated strict Knip findings; project check, format, typecheck, tests, and whitespace pass.",
    "D1 is authoritative. Pre-import, pre-switch, and post-switch Turso exports were byte-identical (SHA-256 1c831d47d89398f9e5fcdf940e9ceb9fa5c0c8f6d07d58812a2e490c78dc9f58).",
    "Explicit retirement approval was received and the Turso database was deleted on 2026-08-02; credential cleanup remains separate.",
    "Migration PR: https://github.com/Significant-Hobbies/swe-interview-prep/pull/40",
    "Status PR: https://github.com/Significant-Hobbies/swe-interview-prep/pull/41",
    "Final production deployment run: https://github.com/Significant-Hobbies/swe-interview-prep/actions/runs/30710480262",
    "Fleet deploy-parity run run_4b1c4a22964238ba4ea6d520b05c949f confirmed SWE Actions and Pages at a515ae1; its nonzero fleet result belongs to 14 unrelated deployment drifts."
  ]
}
