{
  "schemaVersion": "turso-d1-migration-receipt.v1",
  "projectId": "starboard",
  "mode": "cutover",
  "authority": "d1",
  "source": {
    "provider": "turso",
    "name": "starboard",
    "role": "rollback-held",
    "schemaRevision": null,
    "sizeBytes": 2133086208
  },
  "target": {
    "provider": "cloudflare-d1",
    "name": "starboard",
    "role": "authoritative",
    "schemaRevision": "0001_initial.sql",
    "sizeBytes": 156667904
  },
  "schemaChecks": [
    {
      "id": "source-catalog-shape",
      "status": "pass",
      "sourceValue": "29 tables, 28 indexes, 6 triggers, 2 virtual tables",
      "targetValue": "18 relational tables, 2 FTS5 virtual tables, 26 explicit indexes, 6 triggers",
      "detail": "The D1 baseline retains all logical relational and FTS objects; the two libSQL vector indexes are replaced by project-owned Vectorize."
    },
    {
      "id": "local-d1-migration",
      "status": "pass",
      "sourceValue": null,
      "targetValue": "1 migration, 55 commands",
      "detail": "Wrangler applied 0001_initial.sql to isolated local D1 and a synthetic FTS5 query returned its expected repository."
    },
    {
      "id": "local-integrity",
      "status": "pass",
      "sourceValue": null,
      "targetValue": "foreign_key_check empty",
      "detail": "Local D1 returned no foreign-key violations. D1 rejects integrity_check with SQLITE_AUTH, so the production receipt will pair foreign-key checks with exact counts and aggregates."
    },
    {
      "id": "runtime-and-automation-boundaries",
      "status": "pass",
      "sourceValue": "libSQL runtime plus four Turso-backed workflows",
      "targetValue": "D1 and Vectorize bindings, scoped D1 REST operations, authenticated Worker embedding operation",
      "detail": "All maintained seed, enrichment, embedding, digest, runtime, and migration paths are Cloudflare-bound. Embeddings execute through native Worker bindings, so GitHub does not require broad Vectorize API permission; no public raw-SQL endpoint was added."
    }
  ],
  "dataChecks": [
    {
      "id": "deterministic-transfer-tooling",
      "status": "pass",
      "sourceValue": "Turso SQL dump plus vector_extract JSONL",
      "targetValue": "D1 data-only SQL plus validated 768-d Vectorize NDJSON",
      "detail": "Focused tests prove relational rows are retained, FTS shadow rows and vector blobs are stripped, embedding hashes are preserved, and malformed vector records fail closed."
    },
    {
      "id": "production-row-and-aggregate-parity",
      "status": "pass",
      "sourceValue": "1,050,033 rows; sha256 a3d7dd1de16a8de4812cf43cac1037df4bd663c3c47daaffeb0b3aab45640f7f",
      "targetValue": "1,050,033 imported rows before derived embedding catch-up; exact key aggregates; foreign_key_check empty",
      "detail": "The final write-frozen Turso snapshot exactly matched the initial logical digest and all per-table counts/hashes. D1 retained 12,450 repositories, 995,395 star snapshots, repository stars sum 187,672,745, and snapshot stars sum 15,032,597,958."
    },
    {
      "id": "production-vector-parity",
      "status": "pass",
      "sourceValue": "11,925 retained 768-d repository vectors",
      "targetValue": "12,450 768-d Vectorize vectors with matching D1 embedding hashes; zero pending",
      "detail": "The transfer preloaded 11,925 retained vectors. The authenticated Worker workflow generated or refreshed 1,225 pending/drifted vectors, then a proof rerun reported zero remaining."
    }
  ],
  "journeyChecks": [
    {
      "id": "repository-validation",
      "status": "pass",
      "sourceValue": null,
      "targetValue": "148 tests, typecheck, Biome, docs, local D1 migration, OpenNext production build, and Worker startup check",
      "detail": "All local repository gates passed, including Wrangler's startup check. The production build retains a non-blocking dynamic-font warning and uses deprecated Edge middleware because OpenNext cannot package Next 16 Node proxy files."
    },
    {
      "id": "local-worker-smoke",
      "status": "pass",
      "sourceValue": null,
      "targetValue": "local and production health 200, discover 200, unauthenticated list mutation 401, operator route 401",
      "detail": "The OpenNext preview initialized local D1 and preserved the auth boundary. Production acceptance verified D1-backed reads, released the write freeze, and kept the authenticated embedding operation closed to unauthenticated requests."
    },
    {
      "id": "production-performance-baseline",
      "status": "pass",
      "sourceValue": "discover p50 597.34ms; health p50 412.86ms; page weighted LCP 1.34s",
      "targetValue": "discover p50 448.26ms; health p50 343.03ms; page weighted LCP 1.34s",
      "detail": "D1 improved discover p50 25.0% and health p50 16.9%. Weighted page LCP and CLS were unchanged overall; paced discovery probes avoided a platform burst-rate 429 observed only in the unpaced synthetic run."
    },
    {
      "id": "production-cutover",
      "status": "pass",
      "sourceValue": "Turso starboard preserved as rollback-held",
      "targetValue": "D1 starboard and Vectorize starboard-repos authoritative at 43f306b99e272d8dcf4de0c1c760a54221d14233",
      "detail": "Worker version f4530746-bad4-4757-8d69-1b63528722e4 serves 100% of traffic. Production health, reads, auth boundaries, D1/Vectorize binding smoke, and embedding catch-up all passed."
    }
  ],
  "timings": {
    "observedAt": "2026-08-01T22:29:18Z",
    "rehearsalMs": null,
    "writeFreezeMs": 232657
  },
  "approval": {
    "remoteMutationApproved": true,
    "cutoverApproved": true,
    "retirementApproved": false
  },
  "rollback": {
    "sourcePreserved": true,
    "releaseAvailable": true,
    "reconciliationRequired": false
  },
  "result": "pass",
  "notes": [
    "Owning issue: https://github.com/Codevetter/starboard/issues/49. Duplicate issue #50 was closed after discovery.",
    "Baseline PSI run run_b687b85e4d8fac19d9d3e6bf257e825f; report /Users/sarthak/.psi-swarm/reports/psi-swarm-starboard.codevetter.com-2026-08-01T19-02-06.html.",
    "Code cleanup run run_c6e25c1bc56599beb4fcfd6826689f4c found no critical advisories; 14 high advisories and one unused export predate this migration.",
    "Cloudflare Workers Paid capacity was verified before implementation. Turso retirement and secret removal remain separate approval steps.",
    "Cutover PRs #51, #52, and #53 merged; documentation PR #54 merged after all required checks passed. Deploy run 30720998042, operator smoke 30721106035, catch-up 30721151022, and zero-pending proof 30721198381 succeeded.",
    "CI maintenance PR #55 upgraded cloudflare/wrangler-action to v4; main CI 30722081042 and deploy 30722138628 passed without the prior Node 20 action-runtime warning.",
    "Post-cutover PSI report: /Users/sarthak/.psi-swarm/reports/psi-swarm-starboard.codevetter.com_-2026-08-01T22-29-18.html. Turso and its secrets remain rollback-held and were not retired."
  ]
}
