{
  "schemaVersion": "turso-d1-migration-receipt.v1",
  "projectId": "anime-list",
  "mode": "cutover",
  "authority": "d1",
  "source": {
    "provider": "turso",
    "name": "mal-watchlist",
    "role": "rollback-held",
    "schemaRevision": null,
    "sizeBytes": 42074112
  },
  "target": {
    "provider": "cloudflare-d1",
    "name": "anime-list",
    "role": "authoritative",
    "schemaRevision": "0001_initial.sql",
    "sizeBytes": 38342656
  },
  "schemaChecks": [
    {
      "id": "single-database-layout",
      "status": "pass",
      "sourceValue": "one primary Turso database",
      "targetValue": "one D1 database bound as DB",
      "detail": "Anime and manga catalog data plus user-owned state remain in one project-owned D1 database; no second binding is warranted."
    },
    {
      "id": "source-catalog-shape",
      "status": "pass",
      "sourceValue": "14 tables, 25 explicit indexes, no virtual tables",
      "targetValue": "15 application tables, 27 explicit indexes",
      "detail": "The tracked baseline preserves the source shape and adds only the code-visible user_api_tokens table and its two indexes."
    },
    {
      "id": "remote-d1-migration",
      "status": "pass",
      "sourceValue": null,
      "targetValue": "1 migration, 44 commands",
      "detail": "Wrangler applied 0001_initial.sql to D1 database e2d43435-a71b-4d27-8465-5ec8c3a1abdd before data import."
    },
    {
      "id": "integrity-checks",
      "status": "pass",
      "sourceValue": "integrity_check ok; foreign_key_check empty",
      "targetValue": "local integrity_check ok; remote foreign_key_check empty",
      "detail": "Cloudflare rejects remote integrity_check with SQLITE_AUTH, so target integrity is covered by the production-sized local rehearsal, atomic imports, exact parity, and remote foreign-key check."
    }
  ],
  "dataChecks": [
    {
      "id": "production-row-parity",
      "status": "pass",
      "sourceValue": "41333 rows across 14 application tables",
      "targetValue": "41333 matching rows; user_api_tokens 0",
      "detail": "Exact counts matched for 1 user, 4 tags, 1,026 anime watchlist rows, 12 manga watchlist rows, 15,049 anime, 25,128 manga, 55 relation-cache rows, 58 recommendation-cache rows, and all empty tables."
    },
    {
      "id": "production-aggregate-parity",
      "status": "pass",
      "sourceValue": "anime ids 386826827; anime members 1122355299; manga ids 1986196684; manga members 142008270",
      "targetValue": "exact match",
      "detail": "Catalog sums and user, watchlist, and collection signatures matched the final source snapshot exactly."
    },
    {
      "id": "final-source-stability",
      "status": "pass",
      "sourceValue": "pre, final, and post-switch SHA-256 71887bb10666d54b766cfdacf4ba7a7a000580b07cc0ec79c5ecabaab6a63577",
      "targetValue": "no reconciliation required",
      "detail": "All three Turso exports were byte-identical, proving no source writes landed during or after the bounded handoff."
    },
    {
      "id": "ownership-integrity",
      "status": "pass",
      "sourceValue": "owner-scoped source rows",
      "targetValue": "no remote foreign-key violations",
      "detail": "Watchlist, collection, and related owner-scoped rows retained their source keys and remote foreign_key_check returned no rows."
    }
  ],
  "journeyChecks": [
    {
      "id": "repository-validation",
      "status": "pass",
      "sourceValue": null,
      "targetValue": "96 tests, typecheck, Biome, import tests, Worker dry-run, build, and main CI",
      "detail": "PR #33 and main CI run 30712886171 passed the production-sized rehearsal and all repository gates."
    },
    {
      "id": "production-cutover",
      "status": "pass",
      "sourceValue": "Turso retained as rollback-held",
      "targetValue": "D1 authoritative; API and public-page smokes pass",
      "detail": "Deploy run 30713104081 passed. After the status-only merge, run 30713791910 redeployed the active Worker at 100% on SHA e9ee151469a03f882ab12cdc2aa13a9a064604e4 with D1 bound and WRITE_FREEZE false."
    },
    {
      "id": "performance-observation",
      "status": "pass",
      "sourceValue": "API p50 420.0ms and 598.5ms; page p75 TTFB 219ms and LCP 3.98s",
      "targetValue": "API p50 174.6ms and 181.8ms; page p75 TTFB 200ms and LCP 4.30s",
      "detail": "Database-backed API medians improved 58.4% and 69.6%. Page TTFB improved 8.5%; lab LCP regressed 7.9% because render delay, not database time, remained dominant."
    }
  ],
  "timings": {
    "observedAt": "2026-08-01T18:48:16Z",
    "rehearsalMs": null,
    "writeFreezeMs": 61318
  },
  "approval": {
    "remoteMutationApproved": true,
    "cutoverApproved": true,
    "retirementApproved": false
  },
  "rollback": {
    "sourcePreserved": true,
    "releaseAvailable": true,
    "reconciliationRequired": false
  },
  "result": "pass",
  "notes": [
    "Migration PR: https://github.com/Significant-Hobbies/anime-list/pull/33; deploy run: https://github.com/Significant-Hobbies/anime-list/actions/runs/30713104081.",
    "Current-main parity deploy: https://github.com/Significant-Hobbies/anime-list/actions/runs/30713791910; active Worker tag e9ee151469a03f882ab12cdc2aa13a9a064604e4.",
    "D1 import source manifest SHA-256: b31c51b727023a2b3052873d7d836fa947e689ece3af6cbd3294eb409d70dbae; 41,333 statements in 9 atomic chunks.",
    "PSI before run run_ed37794ff3e70e5f27d78c79bfa57a20; after run run_3b69aae27d015b29075039e6d3f7d0b3; compare run run_58e2d945db1dcf4b609e5d66cbb5fb7d.",
    "Turso database and unused Worker secret bindings remain retained for rollback. Retirement or secret removal requires separate explicit approval."
  ]
}
