{
  "schemaVersion": "turso-d1-migration-receipt.v1",
  "projectId": "open-historia",
  "mode": "cutover",
  "authority": "d1",
  "source": {
    "provider": "none",
    "name": "open-historia",
    "role": "none",
    "schemaRevision": null,
    "sizeBytes": null
  },
  "target": {
    "provider": "cloudflare-d1",
    "name": "open-historia",
    "role": "authoritative",
    "schemaRevision": "0000_watery_scrambler.sql",
    "sizeBytes": null
  },
  "schemaChecks": [
    {
      "id": "foreign-keys",
      "status": "pass",
      "sourceValue": "production export",
      "targetValue": "no violations",
      "detail": "The remote D1 foreign-key check returned no violations after import."
    }
  ],
  "dataChecks": [
    {
      "id": "table-row-parity",
      "status": "pass",
      "sourceValue": "1 account, 1 saved game, 1 session, 1 user, 9 verifications",
      "targetValue": "exact match",
      "detail": "Every application-table row count matched the final approved source snapshot."
    }
  ],
  "journeyChecks": [
    {
      "id": "public-and-auth-boundary",
      "status": "pass",
      "sourceValue": "existing public and protected routes",
      "targetValue": "home 200, AI index 200, unauthenticated saves 401",
      "detail": "The custom domain remained healthy after the D1 deploy and again after Turso retirement."
    }
  ],
  "timings": {
    "observedAt": "2026-08-02T06:40:00Z",
    "rehearsalMs": null,
    "writeFreezeMs": null
  },
  "approval": {
    "remoteMutationApproved": true,
    "cutoverApproved": true,
    "retirementApproved": true
  },
  "rollback": {
    "sourcePreserved": false,
    "releaseAvailable": false,
    "reconciliationRequired": false
  },
  "result": "pass",
  "notes": [
    "Migration PR https://github.com/sarthakagrawal927/open-historia/pull/20 merged at 8734ed4e86225f4b1e5c2d74bff567aec8484163.",
    "Production Worker version was tagged with the exact merge SHA and the D1 binding was verified live.",
    "The Turso database was deleted on 2026-08-02 after post-cutover acceptance; credential cleanup remains separate."
  ]
}
